{"acquisition_binding":{"direct_binding":{"direct_analysis_condition":"StimX","direct_file_sha256":{"axis.json":"ab20dbfff81b3e31673708e66f073f3fea61958a67d27736144a881c97b9065e","contributing_guides.parquet":"74aa488489a3784864435723a8255a26e991d647c5dce866eb5bd294ecd4c735","donor_support.parquet":"66c722d9db7bc6eb7005d587a125f3bc2eda1f38a26fe1e4fbc29967ed421128","gene_universe.json":"9db5854a5d93e344f8060b2c35a2ad8b037122fd27421473f19657be9eff2049","guide_support.parquet":"227689aa9f251f68020d57ef0f4fd9808fbf1ddfd07d28638b26f97d2275239f","input_manifest.json":"7fe8ae0410629fa3986be0436f317f03d900984047e0a97ceacccc7b49a4f402","masks.parquet":"bf62b40a008a1b7c7ea25c7634a02b7899986acdde4a5599a54985c5c500a1dd","provenance.json":"56a21bd7de3e6858fa57b54783152f359b0973e85e1a1654b3403768055432d8","screen.parquet":"adc381a287d55d8621ba844647c088eb4627829d06fdf553cdb1adeb0468fc58","verification.json":"b394c1c784fbf3edfaac6f4fb3af3328af2a294f651d8d94dbb46be5de7c9a63"},"direct_gene_universe_sha256":"5e0599fe94a85a03b878cf31bd91a150b59766ed496489d43202daadaa6ac8b0","direct_lane":"research_only","direct_lane_declared":"research_only","direct_mask_sha256":"1649f28a9e05ba22747092537cd6c1c7f1204bd4cbfaaed8428ec172b0d8c110","direct_question_id":"rq_b760ca49d4ab59bc8d2d668efc61e6de","direct_row_count":18,"direct_run_binding_sha256":"d25b236f2030c609ea9d02c09dbe6b2c8e7cb59a1a096056a02cf0f32a855a3d","direct_run_id":"d25b236f2030c609","direct_selection_id":"rq_43d32f0d13d6b71b1ec4e078b8955462","direct_source_target_count":18,"direct_stage2_method":{"arm_evaluable_column":{"away_from_A":"A_evaluable","toward_B":"B_evaluable"},"arm_formula":{"away_from_A":"-sign_A * delta_A","toward_B":"sign_B * delta_B"},"arm_rank_column":{"away_from_A":"rank_away_from_A","toward_B":"rank_toward_B"},"arms":["away_from_A","toward_B"],"combined_objective_permitted":false,"effect_layer_primary":"log_fc","effect_layer_sensitivity":"zscore","formula_id":"spot.stage02.direct.formula.masked_program_delta.v1","headline_arm_permitted":false,"method_id":"spot.stage02.direct.masked_program_projection","method_version":"stage2-direct-v5-pooled-main-two-arm","rank_dtype":"Int64","rank_population":"arm_evaluable_and_non_null_canonical_score","rank_tie_break":"target_id_ascending"},"direct_verifier":{"exit_code":0,"n_checks":147,"n_failed":0,"report_sha256":"3bc06949748e4ac99c25a30d28db04407cc39a0fa564ee6a20a23aaf887022ce","verifier_argv":["python","-m","direct.verify_run","--run-dir","<run>","--inputs-root","<inputs>"],"verifier_module":"direct.verify_run"},"stage1_release":{"hashes":{"code_canonical_sha256":"bac90579227fed0a18fc496e6be2cb38e5a7085284e979d422323b5fb81a123b","code_raw_sha256":"def5cbf734b7082b27755963bb9a96c5d48cc6a3ddc727aec6c84257a8144ca0","environment_canonical_sha256":"6db18ed83168e380b71141b7d2537af052110ff2dbbad20a69d8c56e7f5629ad","environment_raw_sha256":"6b9f0fffe632ca495a9b0e7d1b9dffe3800d7d0f931fd020020b0c6a7db9a2fa","gate_spec_canonical_sha256":"921727148eb5c31c1a7d651bda03e551af0c8f342335f0b681da31ba09945f9e","gate_spec_raw_sha256":"ad2c0765158a48537d82c21e5fbb463368219d8f1068f45652e75b5502585032","input_manifest_canonical_sha256":"ee83bfa557d477ccf5f2844e736c410a5951456b74251d640a9e97c189d005cb","input_manifest_raw_sha256":"9ff67242c9477d2cfdc7a25ce1d66c9ed985726d44677ffa77460bcc0dba9dd6","method_version":"stage1-continuous-v3.0.1","registry_canonical_sha256":"e3e0cb96bc127bf8209596f20edad87c28af3bc63f7a4a2b4ef4c01830124ef3","registry_raw_sha256":"01745a0c8ae8ebc6e4f036b00f410774a1a45c99fff081cdd03bae885cea7472","release_manifest_raw_sha256":"bf2613c70061129bd57d1e9c24c93ab3e81100ba0f89eeb92c0cd75d9c1802cd","scores_canonical_sha256":"ccdabdda13489109de38afa38d5c85e5083f5d117e4fe829340a71a17391a99a","scores_raw_sha256":"9afd04b20ac630dfd24905bd556d9a77cf9a0aa4dcfe638157123c4d9674a82b","validation_canonical_sha256":"86344b8715b62891601fda36db87da372725e7722d5d85501966241d77229f12","validation_raw_sha256":"0b6be2481aae9311b44a0c641f196a59804183a3b52a0b9000786d7ea82eeace"},"kind":"research","method_version":"stage1-continuous-v3.0.1","n_production_selectable":0},"stage1_selection":{"contract_sha256":"5ac4efa16f76a291024bb1eaf116fff80a2ea4460e9b4ee8bcb9abd5f3ad55ee","question_id":"rq_b760ca49d4ab59bc8d2d668efc61e6de","selection_id":"rq_43d32f0d13d6b71b1ec4e078b8955462","stage1_method_version":"stage1-continuous-v3.0.1","stage1_validation_sha256":"0b6be2481aae9311b44a0c641f196a59804183a3b52a0b9000786d7ea82eeace","stage1_validation_status":"bound"},"stage3_artifact_class":"analysis","upstream_gate_context":{"direct_lane":"research_only","note":"upstream context only; Stage 3 does not gate on it","stage1_gate_passed":false,"stage1_n_selectable":0}},"direct_binding_sha256":"491c65aa59a1cea1b29068fc61c08afea855b6d4b50a6eb40609c4469d02780d","direct_run_id":"d25b236f2030c609","per_arm_counts":{"away_from_A":11,"toward_B":11},"policy":{"acquisition_policy_version":"stage3-acquire-public-v1","activity_acquired":false,"adaptive_expansion_permitted":false,"artifact_class":"analysis","chembl_limit":"1000","chembl_release_declared":"CHEMBL_37","direct_gene_lane_rule":"only_an_exact_SINGLE_PROTEIN_chembl_target_carrying_the_mapped_accession_enters_the_direct_gene_lane","molecule_chunk_size":20,"potency_state_when_absent":"not_evaluated","selection_rule":"top_n_per_arm_independently_by_that_arms_own_direct_rank","sources":["uniprot","chembl"],"stop_when_enough_drugs_found":false,"top_per_arm":25,"union_rule":"union_is_for_network_efficiency_only_arm_and_rank_retained","uniprot_fields":"accession,reviewed,organism_name,organism_id,xref_ensembl","uniprot_page_size":"500","uniprot_query_template":"xref:ensembl-<ENSG> AND organism_id:9606","zero_candidates_is_a_valid_result":true},"query_genes":["ENSG00000000200","ENSG00000000202","ENSG00000000204","ENSG00000000205","ENSG00000000206","ENSG00000000208","ENSG00000000209","ENSG00000000211","ENSG00000000212","ENSG00000000213","ENSG00000134460","ENSG00000163599"],"target_queue":[{"arm_desired_target_modulation":"decrease","arm_evidence_tier":"tier3_screen_only","arm_lever_key":"9fec97a22ac315e656aabb3070d82770c60afba3f4479c00a799daa935590b4b","arm_rank":1,"desired_arm":"away_from_A","target_ensembl":"ENSG00000163599","target_id":"ENSG00000163599"},{"arm_desired_target_modulation":"decrease","arm_evidence_tier":"tier3_screen_only","arm_lever_key":"90d19cab8c95ef478abe2d0efcd76eebe6cc6482138641fc4a2f77d7f56695be","arm_rank":2,"desired_arm":"away_from_A","target_ensembl":"ENSG00000134460","target_id":"ENSG00000134460"},{"arm_desired_target_modulation":"decrease","arm_evidence_tier":"tier3_screen_only","arm_lever_key":"d2cd0293894d649cf1c13e820ffb6e2ba31cc103c5d4b1302d4d1d6a2d30599e","arm_rank":3,"desired_arm":"away_from_A","target_ensembl":"ENSG00000000208","target_id":"ENSG00000000208"},{"arm_desired_target_modulation":"decrease","arm_evidence_tier":"tier3_screen_only","arm_lever_key":"d0eeb3e29fce6958073ab9319d5961e67eb1e3e41da90726cd6635666ba9bf4a","arm_rank":4,"desired_arm":"away_from_A","target_ensembl":"ENSG00000000202","target_id":"ENSG00000000202"},{"arm_desired_target_modulation":"decrease","arm_evidence_tier":"tier3_screen_only","arm_lever_key":"1872b83c8033a5d9fd6bb62a57b539114b7d73bc9ba2fbbbbe4cdc406c8eabab","arm_rank":5,"desired_arm":"away_from_A","target_ensembl":"ENSG00000000212","target_id":"ENSG00000000212"},{"arm_desired_target_modulation":"decrease","arm_evidence_tier":"tier3_screen_only","arm_lever_key":"43170051d864694c630a358b29a437a1fba331be0c06ccedaf4111875249bee4","arm_rank":6,"desired_arm":"away_from_A","target_ensembl":"ENSG00000000200","target_id":"ENSG00000000200"},{"arm_desired_target_modulation":"decrease","arm_evidence_tier":"tier3_screen_only","arm_lever_key":"1b087f0d23f53a710e149b71b76a3148fa5fc9358e92235f11e5bbafc7a054eb","arm_rank":7,"desired_arm":"away_from_A","target_ensembl":"ENSG00000000209","target_id":"ENSG00000000209"},{"arm_desired_target_modulation":"decrease","arm_evidence_tier":"tier3_screen_only","arm_lever_key":"50c4c46db42eb59e59b36ab39f25e3c9e7d051874749afc9d22f6bcafc07a773","arm_rank":8,"desired_arm":"away_from_A","target_ensembl":"ENSG00000000204","target_id":"ENSG00000000204"},{"arm_desired_target_modulation":"decrease","arm_evidence_tier":"tier3_screen_only","arm_lever_key":"64842cd775d6c1991872c67e545254cba8fccce3e2c98f1d57a5662f116ade09","arm_rank":9,"desired_arm":"away_from_A","target_ensembl":"ENSG00000000205","target_id":"ENSG00000000205"},{"arm_desired_target_modulation":"decrease","arm_evidence_tier":"tier3_screen_only","arm_lever_key":"2fc25f863044ab70a782117afb78d26913d9ffd843ed0259f3d9c87acfa7c504","arm_rank":10,"desired_arm":"away_from_A","target_ensembl":"ENSG00000000206","target_id":"ENSG00000000206"},{"arm_desired_target_modulation":"decrease","arm_evidence_tier":"tier3_screen_only","arm_lever_key":"ee8bd37315235b51754270d429b9a4ae3c08a4b290241cd729e67670b3d88470","arm_rank":11,"desired_arm":"away_from_A","target_ensembl":"ENSG00000000211","target_id":"ENSG00000000211"},{"arm_desired_target_modulation":"decrease","arm_evidence_tier":"tier3_screen_only","arm_lever_key":"eb142aa388624c55c16dcdef451383c2304d3037ef535d66775fda7b61667f52","arm_rank":1,"desired_arm":"toward_B","target_ensembl":"ENSG00000000211","target_id":"ENSG00000000211"},{"arm_desired_target_modulation":"decrease","arm_evidence_tier":"tier3_screen_only","arm_lever_key":"5e2d51905f2bd148ce74411beb17c35dfcdc300add3b7c864c58fb9d31a2ebd1","arm_rank":2,"desired_arm":"toward_B","target_ensembl":"ENSG00000000213","target_id":"ENSG00000000213"},{"arm_desired_target_modulation":"decrease","arm_evidence_tier":"tier3_screen_only","arm_lever_key":"24911f70d80d932de8fb7393adc77df56c68e8d9200812d92e73c84f75657603","arm_rank":3,"desired_arm":"toward_B","target_ensembl":"ENSG00000000200","target_id":"ENSG00000000200"},{"arm_desired_target_modulation":"no_direction_evidence","arm_evidence_tier":"evaluable_no_directional_signal","arm_lever_key":"a76adcb7671cee1cbc71ae2f62600ff0ec8ef97b4f29b9f94d